{
  "$schema": "../task-manifest.schema.json",
  "id": "task-001-fastapi-swagger-ui-escaping",
  "repo": "https://github.com/tiangolo/fastapi",
  "source_pr": "https://github.com/tiangolo/fastapi/pull/14986",
  "pr_title": "Refactor logic to handle OpenAPI and Swagger UI escaping data",
  "commit_sha": "2f9c914d440e99fe8b62646b51e4d24c5bcd858b",
  "language": [
    "python"
  ],
  "difficulty": 2,
  "context_files": [
    "fastapi/applications.py",
    "fastapi/openapi/docs.py",
    "tests/test_openapi_cache_root_path.py",
    "tests/test_swagger_ui_escape.py"
  ],
  "context_tokens_estimate": 8000,
  "prompt": "In FastAPI's OpenAPI and Swagger UI handling, there are two security-hardening improvements needed: (1) In the OpenAPI schema generation, the `root_path` should not be stored in the `servers` array \u2014 remove the logic that adds `root_path` to the servers list in the OpenAPI response to prevent potential proxy misconfiguration attacks via `x-forwarded-*` headers. (2) In the Swagger UI HTML generation (`fastapi/openapi/docs.py`), escape all user-configurable Swagger UI parameters (like OAuth2 redirect URL, init_oauth config, etc.) to prevent any potential injection when these values are rendered inside HTML/JavaScript. Add tests that verify the root_path is no longer cached/stored in the OpenAPI servers and that Swagger UI config values are properly HTML-escaped.",
  "verification": {
    "type": "test_suite",
    "test_command": "python -m pytest tests/test_openapi_cache_root_path.py tests/test_swagger_ui_escape.py -x -v",
    "expected_files_changed": [
      "fastapi/applications.py",
      "fastapi/openapi/docs.py",
      "tests/test_openapi_cache_root_path.py",
      "tests/test_swagger_ui_escape.py"
    ],
    "reference_diff": "patches/task-001.patch"
  },
  "metadata": {
    "tags": [
      "security-hardening",
      "refactor",
      "xss-prevention"
    ],
    "mined_from": "PR #14986",
    "created_at": "2026-03-29"
  }
}
