{
  "$schema": "../task-manifest.schema.json",
  "id": "task-010-gemini-cli-memory-boundary-markers",
  "repo": "https://github.com/google-gemini/gemini-cli",
  "source_pr": "https://github.com/google-gemini/gemini-cli/pull/24020",
  "pr_title": "feat(context): add configurable memoryBoundaryMarkers setting",
  "commit_sha": "765fb67011c291284dc8e1bcf27603c6845feaf1",
  "language": ["typescript"],
  "difficulty": 3,
  "context_files": [
    "packages/core/src/config/config.ts",
    "packages/core/src/services/contextManager.ts",
    "packages/core/src/utils/memoryDiscovery.ts",
    "packages/core/src/utils/memoryImportProcessor.ts",
    "packages/cli/src/config/config.ts",
    "packages/cli/src/config/settingsSchema.ts",
    "schemas/settings.schema.json",
    "packages/core/src/services/contextManager.test.ts",
    "packages/core/src/utils/memoryDiscovery.test.ts",
    "packages/cli/src/config/config.test.ts",
    "packages/cli/src/test-utils/mockConfig.ts",
    "docs/reference/configuration.md"
  ],
  "context_tokens_estimate": 25000,
  "prompt": "Add a new configurable setting called memoryBoundaryMarkers to Gemini CLI that lets users define custom markers for identifying memory boundaries in context files. The setting should be configurable in the settings schema (packages/cli/src/config/settingsSchema.ts), propagated through the config layer in both packages/cli and packages/core, and consumed by the context manager (packages/core/src/services/contextManager.ts) and memory discovery utility (packages/core/src/utils/memoryDiscovery.ts). The memory import processor should also respect these markers. Update the settings JSON schema, add appropriate tests, and document the new configuration option.",
  "verification": {
    "type": "test_suite",
    "test_command": "npx vitest run packages/core/src/services/contextManager.test.ts packages/core/src/utils/memoryDiscovery.test.ts packages/cli/src/config/config.test.ts",
    "expected_files_changed": [
      "packages/core/src/config/config.ts",
      "packages/core/src/services/contextManager.ts",
      "packages/core/src/utils/memoryDiscovery.ts",
      "packages/core/src/utils/memoryImportProcessor.ts",
      "packages/cli/src/config/config.ts",
      "packages/cli/src/config/settingsSchema.ts",
      "schemas/settings.schema.json",
      "packages/core/src/services/contextManager.test.ts",
      "packages/core/src/utils/memoryDiscovery.test.ts",
      "packages/cli/src/config/config.test.ts",
      "packages/cli/src/test-utils/mockConfig.ts",
      "docs/reference/configuration.md"
    ],
    "reference_diff": "patches/task-010.patch"
  },
  "metadata": {
    "tags": ["feature", "configuration", "context-management", "memory", "gemini-cli"],
    "mined_from": "PR #24020",
    "created_at": "2026-03-31"
  }
}
